Term,Definition,Example
image transforms,Mathematical operations mapping images into alternate domains,Performing a 2D FFT to analyze frequency content
ImageNet,"Vast image database organized by WordNet hierarchy, widely used to pretrain deep networks via large-scale image classification.",Fine-tuning an ImageNet-pretrained ResNet on a medical-imaging task to improve classification accuracy.
imaging system,"Complete setup including optics, sensor, and processing chain to capture and interpret scenes","A drone-mounted camera with gimbal, CMOS sensor, and onboard FPGA for real-time stitching"
indexed image,Image whose pixel values reference entries in a color palette,8-bit GIF using a 256‐color table
indexed image - color map matrix,Table of RGB triplets corresponding to each index,"Palette entry 5 = (255,0,0) defines red"
indexed image - data matrix,Matrix of numeric indices that point into a colormap,"2D array [0,5,3,…] indexing palette entries"
industrial inspection,"Automated visual examination in manufacturing for defects, alignment, or assembly verification",Vision line checking PCB solder joints for missing components
infrared band,"Wavelengths between ~700 nm and 1 mm, sensitive to thermal emissions, used in night-vision and heat mapping",Thermal camera spotting hotspots in building inspections
intensity resolution,Number of discrete gray or color levels per pixel (bit depth),8-bit grayscale image offers 256 shades from black to white
internal image plane,Surface within an imaging system where light converges to form the focused image,The CMOS sensor in a smartphone sits at the internal image plane
Isopreference curve,"Graph showing combinations of image attributes (e.g., noise vs. blur) rated equally acceptable by observers",Designers selecting filter strength that trades off denoising and sharpness for same perceived quality
Java,"Statically typed, object-oriented language running on the Java Virtual Machine (JVM)",Using OpenCV’s Java API to build a cross-platform vision app
JAX,Python library for high-performance numerical computing and automatic differentiation,Using jax.vmap and jax.jit to vectorize and compile a differentiable Sobel filter
jitter,Temporal or spatial variation—often random—in image acquisition or display leading to instability,Slight frame-to-frame misalignment causing a shaky webcam feed
JPEG,Lossy compressed raster format using discrete cosine transform (DCT),Photographs saved at 80 % quality as .jpg for web publishing
JPEG file type,Lossy compressed raster image format using discrete cosine transform,Photograph saved as image.jpg for web display
k-NN,k-Nearest Neighbors—a non-parametric method classifying a sample based on majority vote of k closest training points,Classifying a flower species by comparing its features to the five nearest flowers in feature space
Keras,High-level neural-network API running on top of TensorFlow (and other backends) for rapid prototyping,Building a CNN with Sequential and Functional APIs to classify X-ray images
LANDSAT,Satellite program for Earth observation imagery,LANDSAT 8 capturing global land‐cover changes
law enforcement,"Application of vision algorithms for surveillance, forensics, or identification in policing contexts",Automated facial recognition on CCTV footage to flag suspects
LBP (Local Binary Patterns),Texture descriptor encoding the relationship between a pixel and its neighbors into a binary pattern,Building an LBP histogram to classify textures in fabric inspection
learned features,"Data representations distilled automatically by models (e.g., activations of hidden layers) versus hand-crafted descriptors",Deep network extracting texture patterns for face recognition
LeNet-5,Early convolutional architecture (7 layers) pioneered for digit recognition,Classifying MNIST handwritten digits with ~99% accuracy
lens,Optical element that gathers and focuses light onto an image plane,DSLR camera lens focusing a landscape onto its CMOS sensor
light receptors,General term for sensors that detect light in imaging devices,CCD arrays in astronomical telescopes registering faint starlight
Linux,Open-source Unix-like operating system kernel and distributions,Deploying a Dockerized TensorFlow inference service on Ubuntu
low-level image processing spectrum,"Pixel-level operations for noise suppression, contrast enhancement, and basic filtering",Applying histogram equalization to improve contrast in a dark photograph
luminance component,Perceptual brightness information of a color,Y channel in YCbCr representing grayscale intensity
lux,SI unit measuring illuminance (luminous flux per unit area),Indoor office lighting specified at ~500 lux
Mac OS,Apple’s proprietary Unix-based desktop operating system,Developing macOS Vision framework apps in Xcode
machine language pipeline,Sequence of steps for ML-based image analysis,Data preprocessing → model training → inference
machine learning,Algorithms that learn patterns from data to make predictions or decisions without explicit programming,"Training a CNN on ImageNet to classify 1,000 object categories"
machine learning algorithm,A procedure that learns patterns from data,Training an SVM to classify handwritten digits
machine learning techniques,Methods for training models or extracting patterns,Using k-means clustering to segment an image
machine perception,High-level interpretation of sensor data to infer semantics and context,Self-driving car interpreting traffic signs and pedestrian behavior
MATLAB,Numerical computing environment with an Image Processing Toolbox,Writing a script to perform morphological opening on a binary mask
medical visualization,Interactive rendering and analysis of medical image data—often in 3D or fused modalities,VR-based planning tool displaying segmented organs before surgery
microwave band,"Spectrum from 300 MHz to 300 GHz, penetrates clouds and vegetation, used in radar and remote sensing",Doppler weather radar detecting storm movements
mid-level image processing spectrum,"Region- or feature-based operations such as edge linking, region growing, and contour extraction",Extracting contiguous road boundaries after edge detection
MLPs,Multilayer perceptrons—fully connected networks with one or more hidden layers,Predicting image intensity from small patches
morphological processing,"Shape-based transformations using structuring elements (e.g., erosion, dilation)",Closing small gaps in a binary mask of scanned text by dilation then erosion
motion estimation,Calculating movement of objects or pixels between frames,Using block-matching to stabilize a shaky video
MRI,Non-invasive imaging using strong magnetic fields and radio pulses to produce detailed soft-tissue contrast,Brain scan revealing a glioma
natural light,Illumination provided by the sun or sky,Photographing outdoors at sunset
NDVI maps,Normalized Difference Vegetation Index maps derived from red and near-infrared bands to quantify vegetation health and coverage,Satellite NDVI map highlighting crop vigor across an agricultural region
neural network,"Computational model with interconnected layers of artificial neurons, capable of approximating complex functions",Feed-forward network identifying handwritten digits
neural style transfer,Technique that recombines the content of one image with the artistic style of another image via optimization,Rendering a photograph in the style of Van Gogh’s Starry Night
night-time lights of the world,Satellite-derived composite of artificial lighting visible at night,Mapping urban growth by night lights from VIIRS data
NOAA,"U.S. agency monitoring weather, oceans, and climate via satellites",Using NOAA GOES imagery to track hurricanes
noise reduction,Smoothing or averaging filters to attenuate random pixel-level variations,Applying a Gaussian blur to reduce sensor noise in low-light images
noise removal,Suppressing random or unwanted variations in pixel values,Applying a bilateral filter to reduce sensor noise
NTSC color space,Analog broadcast standard using YIQ channels,Standard‐definition television transmission under NTSC
NumPy,Fundamental package for numerical computing with N-dimensional array support,"Representing and manipulating an image as a 3D NumPy array (height, width, channels)"
Nyquist principle,Sampling theory requiring twice the maximum signal frequency to avoid aliasing,Choosing a camera sensor resolution to capture fine texture without aliasing
object classification,Assigning a semantic label to an entire image or region,Labeling cropped images of leaves as “maple” or “oak”
object detection,Localizing and classifying multiple objects within an image,"Drawing bounding boxes around cars, pedestrians, and traffic signs in street‐view photos"
object recognition,Verifying object identity or category by matching it against known instances,Confirming that two face crops correspond to the same person in access-control systems
object segmentation,Pixel-level partitioning of image regions into semantic or instance masks,Generating a binary mask isolating each cell in microscopy images
offset printing,"Indirect printing process transferring ink from plate to substrate, where digital proofs guide quality control",Using CV to inspect color registration on offset-printed brochures
ONNX,Open Neural Network Exchange format for interoperability between ML frameworks,Exporting a PyTorch YOLOv5 model to ONNX for deployment in a C++ application
opacity,"Degree of transparency encoded by the alpha channel, ranging from fully transparent (0) to opaque (1)",Overlay graphic with semi‐transparent watermark (opacity 0.5)
OpenCL,"Open standard for heterogeneous parallel computing across CPUs, GPUs, and other processors",Accelerating a Sobel filter on the GPU via an OpenCL kernel
OpenCV,Open-source C/C++ library (with Python/Java bindings) offering algorithms for real-time computer vision,Using cv::undistort to rectify fisheye images from a wide-angle lens
OpenGL,"Cross-platform API for rendering 2D/3D graphics, often leveraged for shader-based image processing",Writing a GLSL fragment shader to perform edge detection in a game engine
optic nerve,Bundle of nerve fibers transmitting electrical signals from the retina to the brain,Optic nerve carrying visual information to the visual cortex
optical flow,Field of apparent motion of brightness patterns between frames,Estimating flow vectors for video compression
optical path,"Trajectory that light follows through an optical system, including lenses and mirrors",The series of lenses and mirrors directing light inside a compound microscope
ORB (Oriented FAST and Rotated BRIEF),Combines the FAST keypoint detector and BRIEF descriptor with orientation compensation,SLAM pipeline extracting ORB features for real-time mapping on a mobile robot
output digitized image,Digital representation produced by sampling and quantizing an analog scene,Film scan saved as a TIFF file after drum‐scanner capture
PCA,Principal Component Analysis—a linear dimensionality-reduction technique projecting data onto orthogonal axes of maximum variance,"Reducing 1,024-D feature vectors to 100 principal components before classification"
perceived intensity,Human‐vision‐weighted brightness based on gamma and psychophysical response curves,Gamma‐corrected pixel values for linear display output
PET scan,Functional imaging that tracks a radio-labeled tracer’s metabolic uptake in tissues,Oncology study mapping glucose consumption in tumors
photodiodes,Semiconductor devices that generate electric current proportional to incident light,Photodiodes in a CMOS sensor array detecting scene brightness
photoreceptors,Cells or devices that detect photons and convert them into electrical signals,Rod cells in the eye enabling vision in dim lighting
Photoshop,Commercial image-editing application,Using the clone-stamp tool to remove blemishes
PIL (Pillow),"Python Imaging Library fork for opening, manipulating, and saving many image file formats","Loading a JPEG, resizing to 256×256, and saving as PNG"
Pixel,Smallest image unit representing a single color or intensity value,A 1920×1080 photo consists of about 2 million pixels
PNG,Lossless compressed raster format supporting truecolor and transparency,Diagrams exported with see‐through backgrounds in .png
PNG file type,Lossless compressed raster format supporting transparency,Logo saved as logo.png with an alpha channel
primary colors of light,"Additive primaries: red, green, blue",Combining red and green light yields yellow on a display
primary colors of pigment,"Subtractive primaries: cyan, magenta, yellow","Printing using cyan, magenta, and yellow inks"
Python,Dynamically typed scripting language with extensive ecosystem for scientific computing,Writing a NumPy + OpenCV script to detect edges in images
PyTorch,Python-first deep-learning framework with dynamic computation graphs and strong community support,Implementing a custom ResNet block and training on CIFAR-10
quantity domain,"Data representation where values denote measurable physical quantities (e.g., intensity, color)",Pixel intensity histogram analysis falls in the quantity domain
quantization,Process of mapping continuous analog values to a fixed set of discrete levels,Camera ADC converting sensor voltage to 12-bit digital values
radio band,"Electromagnetic spectrum from ~30 Hz to 300 GHz, used for long-range, low-resolution imaging",Radio telescopes mapping galactic hydrogen emissions
Ranger 7 probe,NASA’s 1964 lunar probe that transmitted high-resolution television images of the Moon’s surface moments before impact,Ranger 7’s close-up images resolving features as small as 115 m
RAW file type,Unprocessed sensor data file from digital cameras,Camera raw output DSC0001.raw for professional editing
real-time ALPR system,Automatic License Plate Recognition pipeline processing video or images to extract plate numbers instantly,Parking garage barrier lifting upon recognizing a resident’s license plate
ResNet,Residual network architecture introducing skip connections to enable ultra-deep models without vanishing gradients,Training a 50-layer ResNet for accurate image classification
ResNet-152,"Variant of ResNet with 152 layers, balancing depth and performance for large-scale image tasks",Fine-tuning ResNet-152 on a custom dataset of wildlife images
resolution,Pixel dimensions (width×height) or density (pixels per inch/mm) of an image,A 4K display with 3840×2160 pixels
retina,Light-sensitive layer of cells at the back of the eye that converts photons to signals,Human retina capturing visual scenes for processing by the brain
RGB,"Color model with three channels—red, green, blue—combined to represent full‐color images",A DSLR sensor capturing a scenic landscape in RGB
RGBA,Extension of RGB with an alpha channel that encodes opacity,A logo PNG with transparent background uses RGBA
RNNs,Recurrent neural networks that model sequential dependencies via cyclic connections,Generating video captions frame by frame
rods,Retinal cells sensitive to low light,Seeing shapes in a dimly lit room
ROI cropping,"Region of Interest, selecting and extracting a specific subregion of an image for focused processing",Cropping the face region from a photo before running a face-recognition model
rotating drum scanners,Scanners that rotate film-wrapped drums and use linear sensors for high-res digitizing,Drum scanner digitizing a 35 mm film negative at 4000 dpi
sampling,Measuring scene information at discrete spatial or temporal intervals,Video recorded at 30 frames per second
saturation component,Degree of color purity or intensity,S = 0.75 in HSL for a vivid pink
scene element,Individual object or region within an image that contributes to overall interpretation,"Classifying cars, pedestrians, and road in an autonomous-driving scene"
scene understanding,"Holistic analysis combining detected elements, spatial relationships, and semantics","Inferring “intersection ahead” from grouped lane markings, signs, and crosswalks"
scikit-image,Python library of algorithms for image processing built on NumPy/SciPy,Applying skimage.filters.gaussian for smoothing microscopy images
SciPy,"Python ecosystem module for scientific computing, includes ndimage subpackage for multi-dimensional filters",Performing morphological opening and closing with scipy.ndimage.morphology.binary_opening
segmentation,Partitioning an image into coherent regions or labeled objects based on pixel similarity,"Semantic segmentation of road scenes into “road,” “pedestrian,” and “vehicle” classes"
semi-supervised learning,Hybrid approach combining a small set of labeled data with large amounts of unlabeled data to improve model performance,Fine-tuning a segmentation network with a few hand-annotated masks plus many unlabeled scans
sharpening,Emphasizing high-frequency components to accentuate edges and fine details,Unsharp mask filter boosting edge contrast in a portrait
Shi-Tomasi,Corner detector that finds “good” features by evaluating the minimum eigenvalue of the local autocorrelation matrix,Tracking strong interest points across video frames for motion analysis
SIFT (Scale-Invariant Feature Transform),Detects and describes local features invariant to scale and rotation,Stitching overlapping photos into a panorama by matching SIFT keypoints
SIFT keypoints,Scale-Invariant Feature Transform interest points,Matching landmark points between aerial photographs
Sobel,Gradient operator computing approximate first derivatives in X and Y directions,Detecting vertical edges on a road surface with cv2.Sobel
spatial resolution,Smallest discernible detail in an image,A scanner’s 600 dpi capturing fine newspaper print
specialized image hardware,Dedicated processors or circuits optimized for intensive image processing tasks,FPGA-based board in an industrial inspection camera for real-time defect detection
supervised learning,Training paradigm using labeled examples (input paired with target output),Teaching a classifier to label cats vs. dogs from annotated photos
supervised learning pipeline,"Sequence of steps in a supervised ML workflow: data collection, labeling, preprocessing, training, validation, and deployment","Building an object detector: collect images, annotate boxes, augment data, train, tune, and export model"
SURF (Speeded-Up Robust Features),Approximation of SIFT that uses integral images and Hessian matrix for faster keypoint detection,Real-time object recognition by matching SURF descriptors
SVG file type,XML-based vector graphic format scalable without loss,Icon drawn as icon.svg for responsive UI
SVMs,Support Vector Machines—algorithms that find hyperplanes maximizing margin between classes,Separating handwritten digits using an RBF-kernel SVM
television band,Subset of the VHF/UHF radio spectrum allocated for broadcast television signals (54 MHz–806 MHz in US),Over-the-air TV antenna receiving local broadcast channels
TensorFlow,"End-to-end open-source platform for machine learning, supporting training and deployment at scale",Training an image classifier on ImageNet using tf.keras
TensorRT,NVIDIA’s high-performance deep-learning inference optimizer and runtime,Converting a TensorFlow model to a TensorRT engine for real-time inference on Jetson Xavier
three-dimensional image,"Volumetric data representation along X, Y, and Z axes",3D reconstruction of cerebral vasculature from CT angiography
TIFF file type,Flexible lossless raster format for high-quality images,Scanned map archived as map.tiff for print
time domain,"Representation of data varying over time, typically used for sequences of images (video)",Analyzing frame‐by‐frame motion in a video clip
tomography,"Cross-sectional imaging by reconstructing slice data from penetrating waves (e.g., X-rays, sound, electrons)",CT chest scan showing axial slices of lung anatomy
traditional computer vision pipeline,Hand-crafted stages from pre-processing to classification,Filtering → edge detection → feature extraction → rule-based decision
traditional computer vision techniques,Non-learning methods using explicit algorithms,Detecting circles via Hough transform
traditional neural network,"Early, shallow architectures (few hidden layers) used for basic pattern recognition",Single-hidden-layer perceptron distinguishing line-drawn shapes
transmission electron microscopy,High-resolution microscopy transmitting electrons through ultra-thin samples,Imaging viral capsid structure at sub-nanometer scale
two-dimensional image,Flat image representation with only height and width dimensions,Standard X-ray radiograph of a fractured wrist
ultrasound,Real-time visualization using high-frequency sound waves and their echoes,Fetal ultrasound monitoring development in utero
ultraviolet band,"Wavelengths from 10 nm to 380 nm, used to detect fluorescence and surface features",UV photography revealing varnish layers on paintings
Unix,"Family of multitasking, multiuser OSes that influenced modern operating systems",Running legacy C-based image-processing code on Solaris
unsupervised learning,"Learning patterns from unlabeled data by discovering structure, clusters, or latent representations",Grouping animal images into clusters without prior species labels
VGG16,"Deep CNN with 16 weight layers using small (3×3) convolution filters, known for uniform architecture",Feature extraction for transfer learning on medical X-rays
video stabilization,Removing unwanted camera shake by estimating frame-to-frame motion and compensating via transformation,Smoothing handheld footage to produce a steady output in post-production
video tracking,Continuously following one or more objects across video frames using motion prediction and data association,Tracking a ball’s trajectory in sports analytics
VIIRS instruments,Visible Infrared Imaging Radiometer Suite sensors onboard NOAA/NASA satellites recording global radiometric measurements,VIIRS night-time lights data used to monitor urban expansion
virtual reality,Simulated 3D environment presented to the user,Oculus Rift rendering stereoscopic scenes
visible band,Light wavelengths from ~380 nm to 740 nm perceptible by the human eye,Standard digital cameras capturing everyday scenes
vision specialist,"Expert (human or algorithm) focusing on vision tasks, from annotation to fine-tuning model performance",Data scientist labeling bounding boxes on traffic-cam images for training a detection model
watermarking,Embedding hidden or visible marks to assert ownership or authenticity,Inserting a semi-transparent logo into a photograph’s corner
watershed algorithm,Treats grayscale images as topographic surfaces and “floods” catchment basins to segment touching objects,Separating overlapping cells in microscopy images
WebP file type,Modern image format with both lossy and lossless compression modes,Website hero image as header.webp to reduce page load
Wiener deconvolution,Inverse filtering technique that accounts for blur and additive noise via a Wiener filter,Deblurring a motion-blurred document scan using estimated point-spread function
Windows,Microsoft’s proprietary OS with broad software compatibility,Running MATLAB Computer Vision Toolbox on Windows 10
x-ray band,High-energy waves from 0.01 nm to 10 nm that penetrate soft tissues,Medical X-ray radiograph showing bone fractures
YCbCr color space,"Digital color space with luminance (Y) and chroma (Cb, Cr) channels",JPEG compression storing Y and CbCr separately
YIQ color space,"Analog color space splitting luminance (Y) and chrominance (I, Q)",Separating brightness and color in old‐school TV
YOLO,“You Only Look Once”—real-time object detection framework predicting bounding boxes and class probabilities in a single forward pass,Detecting pedestrians and vehicles at 45 fps in dash-cam footage